{
  "$schema": "https://json-schema.org/draft/2020-12/schema",
  "$id": "https://scout.local/schema/target_host_u3_viscoart0p1_extension_policy_v1.json",
  "type": "object",
  "additionalProperties": false,
  "required": ["schema_version", "document_type", "run_id", "purpose", "status", "claim_ceiling", "parents", "tools", "gpu", "inputs", "restart", "solver", "sandbox", "run", "expected_output", "limits", "single_delta"],
  "properties": {
    "schema_version": {"const": "smpcc-r8-liquid-u3-viscoart0p1-extension-policy-v1"},
    "document_type": {"const": "SMPCC_R8_LIQUID_U3_VISCOART0P1_EXTENSION_POLICY_V1"},
    "run_id": {"const": "u3_c1m_gpu_viscoart0p1_extend_from_0401_20260811T065812Z_v6"},
    "purpose": {"const": "extended_undamped_settling"},
    "status": {"const": "FROZEN_PENDING_EXACTLY_ONE_GPU_EXTENSION"},
    "claim_ceiling": {"const": "DEVELOPMENT_ONLY_SOFTWARE_NUMERICAL_NOT_PHYSICAL_FIDELITY"},
    "parents": {"$ref": "#/$defs/parents"},
    "tools": {"$ref": "#/$defs/tools"},
    "gpu": {"$ref": "#/$defs/gpu"},
    "inputs": {"$ref": "#/$defs/inputs"},
    "restart": {"$ref": "#/$defs/restart"},
    "solver": {"$ref": "#/$defs/solver"},
    "sandbox": {"$ref": "#/$defs/sandbox"},
    "run": {"$ref": "#/$defs/run"},
    "expected_output": {"$ref": "#/$defs/expectedOutput"},
    "limits": {"$ref": "#/$defs/limits"},
    "single_delta": {"$ref": "#/$defs/singleDelta"}
  },
  "$defs": {
    "sha256": {"type": "string", "pattern": "^[0-9a-f]{64}$"},
    "absolutePath": {"type": "string", "pattern": "^/[^\\u0000]*$"},
    "parentIdentity": {
      "type": "object",
      "additionalProperties": false,
      "required": ["path", "sha256"],
      "properties": {
        "path": {"$ref": "#/$defs/absolutePath"},
        "sha256": {"$ref": "#/$defs/sha256"}
      }
    },
    "fileIdentity": {
      "type": "object",
      "additionalProperties": false,
      "required": ["path", "sha256", "size_bytes", "mode", "inode", "nlink"],
      "properties": {
        "path": {"$ref": "#/$defs/absolutePath"},
        "sha256": {"$ref": "#/$defs/sha256"},
        "size_bytes": {"type": "integer", "minimum": 1, "maximum": 134217728},
        "mode": {"type": "string", "pattern": "^[0-7]{4}$"},
        "inode": {"type": "integer", "minimum": 1},
        "nlink": {"const": 1}
      }
    },
    "parents": {
      "type": "object",
      "additionalProperties": false,
      "required": ["plan", "build_receipt", "static_audit_receipt", "stage3_postvalidation", "numerical_contract", "prior_policy", "prior_qc", "prior_tail_final", "legacy_runner", "runner", "schema", "tests", "qc", "qc_schema", "qc_tests"],
      "properties": {
        "plan": {"$ref": "#/$defs/parentIdentity"},
        "build_receipt": {"$ref": "#/$defs/parentIdentity"},
        "static_audit_receipt": {"$ref": "#/$defs/parentIdentity"},
        "stage3_postvalidation": {"$ref": "#/$defs/parentIdentity"},
        "numerical_contract": {"$ref": "#/$defs/parentIdentity"},
        "prior_policy": {"$ref": "#/$defs/parentIdentity"},
        "prior_qc": {"$ref": "#/$defs/parentIdentity"},
        "prior_tail_final": {"$ref": "#/$defs/parentIdentity"},
        "legacy_runner": {"$ref": "#/$defs/parentIdentity"},
        "runner": {"$ref": "#/$defs/parentIdentity"},
        "schema": {"$ref": "#/$defs/parentIdentity"},
        "tests": {"$ref": "#/$defs/parentIdentity"},
        "qc": {"$ref": "#/$defs/parentIdentity"},
        "qc_schema": {"$ref": "#/$defs/parentIdentity"},
        "qc_tests": {"$ref": "#/$defs/parentIdentity"}
      }
    },
    "tools": {
      "type": "object",
      "additionalProperties": false,
      "required": ["bwrap", "nvidia_smi", "python", "sudo"],
      "properties": {
        "bwrap": {"$ref": "#/$defs/parentIdentity"},
        "nvidia_smi": {"$ref": "#/$defs/parentIdentity"},
        "python": {"$ref": "#/$defs/parentIdentity"},
        "sudo": {"$ref": "#/$defs/parentIdentity"}
      }
    },
    "gpu": {
      "type": "object",
      "additionalProperties": false,
      "required": ["index", "uuid", "pci_bus_id", "name", "driver_version", "device_paths"],
      "properties": {
        "index": {"const": 0},
        "uuid": {"const": "GPU-d29cd22d-8b25-8f4e-9dcf-f2fc4bb113fb"},
        "pci_bus_id": {"const": "00000000:01:00.0"},
        "name": {"const": "NVIDIA GeForce RTX 5080 Laptop GPU"},
        "driver_version": {"const": "580.173.02"},
        "device_paths": {
          "type": "array",
          "prefixItems": [
            {"const": "/dev/nvidia0"},
            {"const": "/dev/nvidiactl"},
            {"const": "/dev/nvidia-uvm"},
            {"const": "/dev/nvidia-uvm-tools"}
          ],
          "items": false,
          "minItems": 4,
          "maxItems": 4
        }
      }
    },
    "inputs": {
      "type": "object",
      "additionalProperties": false,
      "required": ["candidate", "dsph_config", "case_bi4", "case_xml", "restart_part", "restart_head"],
      "properties": {
        "candidate": {"$ref": "#/$defs/fileIdentity"},
        "dsph_config": {"$ref": "#/$defs/fileIdentity"},
        "case_bi4": {"$ref": "#/$defs/fileIdentity"},
        "case_xml": {"$ref": "#/$defs/fileIdentity"},
        "restart_part": {"$ref": "#/$defs/fileIdentity"},
        "restart_head": {"$ref": "#/$defs/fileIdentity"}
      }
    },
    "restart": {
      "type": "object",
      "additionalProperties": false,
      "required": ["enabled", "part_index", "part_first", "guest_dir"],
      "properties": {
        "enabled": {"const": true},
        "part_index": {"const": 401},
        "part_first": {"const": 401},
        "guest_dir": {"const": "/restart"}
      }
    },
    "environment": {
      "type": "object",
      "additionalProperties": false,
      "required": ["HOME", "PATH", "LC_ALL", "LANG", "TZ", "TMPDIR", "OMP_NUM_THREADS", "OMP_DYNAMIC", "CUDA_VISIBLE_DEVICES"],
      "properties": {
        "HOME": {"const": "/nonexistent"},
        "PATH": {"const": "/usr/bin"},
        "LC_ALL": {"const": "C"},
        "LANG": {"const": "C"},
        "TZ": {"const": "UTC0"},
        "TMPDIR": {"const": "/tmp"},
        "OMP_NUM_THREADS": {"const": "1"},
        "OMP_DYNAMIC": {"const": "FALSE"},
        "CUDA_VISIBLE_DEVICES": {"const": "0"}
      }
    },
    "solver": {
      "type": "object",
      "additionalProperties": false,
      "required": ["argv", "environment", "expected_particles", "expected_moving", "expected_fluid"],
      "properties": {
        "argv": {
          "type": "array",
          "prefixItems": [
            {"const": "/runtime/DualSPHysics5.4_linux64"}, {"const": "/case/C1M_zero"}, {"const": "/output"},
            {"const": "-gpu:0"}, {"const": "-ompthreads:1"}, {"const": "-stable:1"}, {"const": "-vres:0"},
            {"const": "-cellmode:full"}, {"const": "-cfl:0.1"}, {"const": "-partbegin:401:401"}, {"const": "/restart"},
            {"const": "-shifting:none"}, {"const": "-viscoart:0.1"}, {"const": "-tmax:30.05"}, {"const": "-tout:0.05"},
            {"const": "-sv:binx,info"}, {"const": "-svres:1"}, {"const": "-svtimers:0"}, {"const": "-svdomainvtk:0"},
            {"const": "-saveposdouble:1"}, {"const": "-nortimes:1"}, {"const": "-createdirs:1"}, {"const": "-csvsep:0"}
          ],
          "items": false,
          "minItems": 23,
          "maxItems": 23
        },
        "environment": {"$ref": "#/$defs/environment"},
        "expected_particles": {"const": 9078},
        "expected_moving": {"const": 2669},
        "expected_fluid": {"const": 6409}
      }
    },
    "sandbox": {
      "type": "object",
      "additionalProperties": false,
      "required": ["model", "stage_root", "network", "guest_uid", "guest_gid", "guest_groups", "guest_cap_eff", "host_write_bind_count", "project_workspace_write_bind_count", "apparmor_profile_used", "preserve_stage"],
      "properties": {
        "model": {"const": "ROOT_ONLY_VAR_TMP_TRANSPORT_TO_UID1000_CAP0_BWRAP_NETNS_TO_O_EXCL_LAB_EXPORT"},
        "stage_root": {"const": "/var/tmp/r8-liquid-u3-stage4-u3-c1m-gpu-viscoart0p1-extend-from-0401-20260811t065812z-v6"},
        "network": {"const": false},
        "guest_uid": {"const": 1000},
        "guest_gid": {"const": 1000},
        "guest_groups": {"type": "array", "prefixItems": [{"const": 1000}], "items": false, "minItems": 1, "maxItems": 1},
        "guest_cap_eff": {"const": "0000000000000000"},
        "host_write_bind_count": {"const": 1},
        "project_workspace_write_bind_count": {"const": 0},
        "apparmor_profile_used": {"const": false},
        "preserve_stage": {"const": true}
      }
    },
    "run": {
      "type": "object",
      "additionalProperties": false,
      "required": ["attempt_root", "output_root", "start_receipt", "final_receipt", "failure_receipt", "stdout_log", "stderr_log", "resource_log"],
      "properties": {
        "attempt_root": {"$ref": "#/$defs/absolutePath"},
        "output_root": {"$ref": "#/$defs/absolutePath"},
        "start_receipt": {"$ref": "#/$defs/absolutePath"},
        "final_receipt": {"$ref": "#/$defs/absolutePath"},
        "failure_receipt": {"$ref": "#/$defs/absolutePath"},
        "stdout_log": {"$ref": "#/$defs/absolutePath"},
        "stderr_log": {"$ref": "#/$defs/absolutePath"},
        "resource_log": {"$ref": "#/$defs/absolutePath"}
      }
    },
    "expectedOutput": {
      "type": "object",
      "additionalProperties": false,
      "required": ["start_time_s", "end_time_s", "output_period_s", "part_first", "part_last", "part_count", "maximum_output_bytes"],
      "properties": {
        "start_time_s": {"const": 20.05},
        "end_time_s": {"const": 30.05},
        "output_period_s": {"const": 0.05},
        "part_first": {"const": 401},
        "part_last": {"const": 601},
        "part_count": {"const": 201},
        "maximum_output_bytes": {"const": 268435456}
      }
    },
    "limits": {
      "type": "object",
      "additionalProperties": false,
      "required": ["wall_timeout_seconds", "kill_after_seconds", "monitor_interval_seconds", "minimum_mem_available_bytes", "maximum_output_bytes"],
      "properties": {
        "wall_timeout_seconds": {"const": 1800},
        "kill_after_seconds": {"const": 10},
        "monitor_interval_seconds": {"const": 10},
        "minimum_mem_available_bytes": {"const": 4294967296},
        "maximum_output_bytes": {"const": 268435456}
      }
    },
    "singleDelta": {
      "type": "object",
      "additionalProperties": false,
      "required": ["parameter", "baseline", "candidate", "other_numerical_parameters_changed"],
      "properties": {
        "parameter": {"const": "OBSERVATION_WINDOW"},
        "baseline": {"const": "UNDAMPED_10.05_TO_20.05_SECONDS"},
        "candidate": {"const": "UNDAMPED_20.05_TO_30.05_SECONDS"},
        "other_numerical_parameters_changed": {"const": false}
      }
    }
  }
}
